{
  "schema_version": "demo-history-dataset-v1",
  "dataset_id": "019b0000-0000-7000-8000-000000000100",
  "path_catalog_version": "path-catalog-v1",
  "coverage_start": "2026-07-17T02:00:00.000Z",
  "coverage_end": "2026-07-18T02:00:00.000Z",
  "records": [
    {
      "schema_version": "gateway-http-v1",
      "event_id": "019b0000-0000-7000-8000-000000000101",
      "request_id": "019b0000-0000-7000-8000-000000000102",
      "trace_id": "019b0000-0000-7000-8000-000000000103",
      "idempotency_key": "sha256:1111111111111111111111111111111111111111111111111111111111111111",
      "started_at": "2026-07-17T03:00:00.000Z",
      "completed_at": "2026-07-17T03:00:00.007Z",
      "source_ip": "203.0.113.20",
      "method": "POST",
      "protocol": "HTTP/1.1",
      "route_label": "login",
      "path_catalog_version": "path-catalog-v1",
      "suspicious_path_id": "none",
      "host": "app.example.test",
      "service_label": "demo-app",
      "status_code": 401,
      "request_bytes": 128,
      "response_bytes": 431,
      "latency_ms": 7
    },
    {
      "schema_version": "auth-event-v1",
      "event_id": "019b0000-0000-7000-8000-000000000104",
      "gateway_request_id": "019b0000-0000-7000-8000-000000000102",
      "trace_id": "019b0000-0000-7000-8000-000000000103",
      "idempotency_key": "sha256:2222222222222222222222222222222222222222222222222222222222222222",
      "occurred_at": "2026-07-17T03:00:00.006Z",
      "source_ip": "203.0.113.20",
      "service_label": "demo-app",
      "route_label": "login",
      "account_hash": "hmac-sha256:3333333333333333333333333333333333333333333333333333333333333333",
      "outcome": "failed"
    },
    {
      "schema_version": "gateway-http-v1",
      "event_id": "019b0000-0000-7000-8000-000000000105",
      "request_id": "019b0000-0000-7000-8000-000000000106",
      "trace_id": "019b0000-0000-7000-8000-000000000107",
      "idempotency_key": "sha256:4444444444444444444444444444444444444444444444444444444444444444",
      "started_at": "2026-07-17T14:00:00.000Z",
      "completed_at": "2026-07-17T14:00:00.004Z",
      "source_ip": "203.0.113.20",
      "method": "GET",
      "protocol": "HTTP/1.1",
      "route_label": "home",
      "path_catalog_version": "path-catalog-v1",
      "suspicious_path_id": "none",
      "host": "app.example.test",
      "service_label": "demo-app",
      "status_code": 200,
      "request_bytes": 0,
      "response_bytes": 512,
      "latency_ms": 4
    },
    {
      "schema_version": "gateway-http-v1",
      "event_id": "019b0000-0000-7000-8000-000000000108",
      "request_id": "019b0000-0000-7000-8000-000000000109",
      "trace_id": "019b0000-0000-7000-8000-00000000010a",
      "idempotency_key": "sha256:5555555555555555555555555555555555555555555555555555555555555555",
      "started_at": "2026-07-18T01:59:00.000Z",
      "completed_at": "2026-07-18T01:59:00.003Z",
      "source_ip": "203.0.113.20",
      "method": "GET",
      "protocol": "HTTP/1.1",
      "route_label": "health",
      "path_catalog_version": "path-catalog-v1",
      "suspicious_path_id": "none",
      "host": "app.example.test",
      "service_label": "demo-app",
      "status_code": 204,
      "request_bytes": 0,
      "response_bytes": 0,
      "latency_ms": 3
    }
  ],
  "source_health": [
    {
      "sender_id": "auth-demo",
      "sender_epoch": "EREREREREREREREREREREQ",
      "coverage_start": "2026-07-17T02:00:00.000Z",
      "coverage_end": "2026-07-18T02:00:00.000Z",
      "coverage_status": "complete",
      "first_sequence": 1,
      "last_sequence": 1,
      "unresolved_intervals": []
    },
    {
      "sender_id": "gateway-demo",
      "sender_epoch": "IiIiIiIiIiIiIiIiIiIiIg",
      "coverage_start": "2026-07-17T02:00:00.000Z",
      "coverage_end": "2026-07-18T02:00:00.000Z",
      "coverage_status": "complete",
      "first_sequence": 1,
      "last_sequence": 3,
      "unresolved_intervals": []
    }
  ]
}
